"Agency","Subagency","accountID","Title","Obligation","Unobligated"
"US Agencies - Non-CFO Act","Government Accountability Office",114,"Salaries and Expenses, Government Accountability Office",581021257.15,36258189.5
"US Agencies - Non-CFO Act","Legislative Branch Boards and Commissions",2650,"Expenses, Congressional-Executive Commission on the People's Republic of China",2090621.45,1726305.65
"US Agencies - Non-CFO Act","Legislative Branch Boards and Commissions",119,"Salaries and Expenses, Commission on Security and Cooperation in Europe",2551597.49,3014992.85
"US Agencies - Non-CFO Act","Legislative Branch Boards and Commissions",122,"International Conferences and Contingencies, House and Senate   Expenses",50000,1763227.47
"US Agencies - Non-CFO Act","Courts of Appeals, District Courts, and Other Judicial Services",146,"Court Security, Court of Appeals, District Courts, and Other Judicial Services, The Judiciary",484558541.95,12623502.38
"Department of Agriculture","Office of the Secretary",275,"Office of the Under Secretary for Marketing and Regulatory Programs, Cooperative State Research, Education, and Extension Service, Agriculture",844913.51,406845.87
"Department of Agriculture","Office of the Secretary",268,"Production, Processing and Marketing, Office of the Secretary, Agriculture",120090103.64,11525575.07
"Department of Agriculture","Office of the Secretary",271,"Office of the Assistant Secretary for Administration, Agriculture",9938.44,4824.15
"Department of Agriculture","Office of the Secretary",392,"Office of the Under Secretary for Food Safety, Agriculture",587066,463644.51
"Department of Agriculture","Office of the Secretary",272,"Office of the Assistant Secretary for Governmental and Public Affairs, Agriculture",0.18,138667.09
"Department of Agriculture","Office of the Secretary",274,"Office of the Under Secretary for Research, Education and Economics, Agriculture",3960550.76,336402.22
"Department of Agriculture","Office of the Secretary",276,"Office of the Under Secretary for Farm and Foreign Agricultural Services, Agriculture",835770.19,276981.89
"Department of Agriculture","Office of the Secretary",277,"Office of the Under Secretary for Rural Development, Agriculture",928627.99,392392.28
"Department of Agriculture","Office of the Secretary",278,"Office of the Assistant Secretary for Natural Resources and Environment, Agriculture",901540.59,389481.5
"Department of Agriculture","Office of the Secretary",279,"Office of the Under Secretary for Food, Nutrition and Consumer Services, Agriculture",758271.05,401782.24
"Department of Agriculture","Office of the Secretary",270,"Departmental Administration, Agriculture",20516.75,51743.27
"Department of Agriculture","Office of the Secretary",298,"Outreach for Socially Disadvantaged Farmers, National Institute of Food and Agriculture, Agriculture",3554993.64,1019620.6
"Department of Agriculture","Office of the Secretary",280,"Office of the Assistant Secretary for Civil Rights, Agriculture",774898.48,286062.94
"Department of Agriculture","Office of the Secretary",286,"Office of Communications, Agriculture",0,92943.3
"Department of Agriculture","Office of the Secretary",266,"Homeland Security Staff, Agriculture",26520.48,5962.28
"Department of Agriculture","Office of the Secretary",281,"Office of Tribal Relations, Agriculture",0,2078.74
"Department of Agriculture","Office of the Secretary",282,"Office of Advocacy and Outreach, Executive Operations, Agriculture",64.89,144218.03
"Department of Agriculture","Office of the Secretary",476,"Gifts and Bequests, Agriculture",558514.56,4448928.42
"Department of Agriculture","Executive Operations",273,"Office of the Chief Economist, Executive Operations, Agriculture",20051468.99,3322041.11
"Department of Agriculture","Executive Operations",299,"Office of Hearings and Appeals Division, Executive Operations, Agriculture",14010305.38,733509.35
"Department of Agriculture","Executive Operations",296,"Office of Budget and Program Analysis, Executive Operations, Agriculture",8606470.53,4333896.2
"Department of Agriculture","Executive Operations",267,"Expenses, Common Computing Environment, Agriculture",0,35128.15
"Department of Agriculture","Executive Operations",408,"Working Capital Fund, Agriculture",961603825.26,237136775.86
"Department of Agriculture","Office of Chief Information Officer",263,"Expenses, Office of the Chief Information Officer, Agriculture",68242841.58,1694431.13
"Department of Agriculture","Office of Chief Financial Officer",264,"Expenses, Office of the Chief Financial Officer, Agriculture",8135925.35,862065.64
"Department of Agriculture","Office of Civil Rights",393,"Office of Civil Rights, Agriculture",29978998.07,2623314.2
"Department of Agriculture","Hazardous Materials Management",294,"Hazardous Materials Management, Agriculture",4584205.12,156542.84
"Department of Agriculture","Buildings and Facilities",269,"Agriculture Buildings and Facilities, Agriculture",71257447.37,45370375.99
"Department of Agriculture","Office of Inspector General",301,"Office of the Inspector General, Agriculture",101306954.98,15811947.81
"Department of Agriculture","Office of Inspector General",440,"Inspector General Assets Forfeiture, Treasury",941332.65,4797217.48
"Department of Agriculture","Office of Inspector General",439,"Inspector General Assets Forfeiture, Justice",1050861.25,5351591.43
"Department of Agriculture","Office of Inspector General",300,"Office of Inspector General - Recovery Act, Agriculture",36.65,0
"Department of Agriculture","Office of the General Counsel",360,"Office of the General Counsel, Agriculture",49195150.07,1013020.13
"Department of Agriculture","Office of the General Counsel",284,"Office of Ethics, Agriculture",3991746.55,1615514.13
"Department of Agriculture","Economic Research Service",336,"Economic Research Service, Agriculture",90773818.66,3254107.18
"Department of Agriculture","Economic Research Service",481,"Miscellaneous Contributed Funds, Economic Research Service, Agriculture",0,1080.46
"Department of Agriculture","National Agricultural Statistics Service",337,"National Agricultural Statistics Service, Agriculture",206833273.36,206225.06
"Department of Agriculture","National Agricultural Statistics Service",479,"Miscellaneous Contributed Funds, National Agricultural Statistics Service, Agriculture",61725.91,54945.4
"Department of Agriculture","Agricultural Research Service",326,"Salaries and Expenses, Agricultural Research Service, Agricullture",1339953311.71,47548787.85
"Department of Agriculture","Agricultural Research Service",432,"Concessions Fees and Volunteer Services, Agricultural Research Service, Agriculture",21208.25,641253.01
"Department of Agriculture","Agricultural Research Service",327,"Buildings and Facilities, Agricultural Research Service, Agriculture",147268942.34,200995693.94
"Department of Agriculture","Agricultural Research Service",478,"Miscellaneous Contributed Funds, Agricultural Research Service, Agriculture",25388969.48,30150661.31
"Department of Agriculture","National Institute of Food and Agriculture",333,"Integrated Activities, National Institute of Food and Agriculture, Agriculture",131770383.48,24619383.51
"Department of Agriculture","National Institute of Food and Agriculture",304,"Biomass Research and Development, National Institute of Food and Agriculture, Agriculture",403100.48,8655688.14
"Department of Agriculture","National Institute of Food and Agriculture",331,"Research and Education Activities, National Institute of Food and Agriculture, Agriculture",828765561.03,500528155.28
"Department of Agriculture","National Institute of Food and Agriculture",416,"Native American Institutions Endowment Fund, Agriculture",6394419.14,1305839.21
"Department of Agriculture","National Institute of Food and Agriculture",332,"Buildings and Facilities, National Institute of Food and Agriculture, Agriculture",7363.47,1662898.36
"Department of Agriculture","National Institute of Food and Agriculture",295,"Extension Activities, National Institute of Food and Agriculture, Agriculture",522354865.44,48021866.09
"Department of Agriculture","Animal and Plant Health Inspection Service",334,"Salaries and Expenses, Animal and Plant Health Inspection Service",1222255679.59,520016604
"Department of Agriculture","Animal and Plant Health Inspection Service",411,"Agricultural Quarantine Inspection User Fee Account, Animal and Plant Health Inspection Service, Agriculture",242743140.37,122315863.55
"Department of Agriculture","Animal and Plant Health Inspection Service",335,"Buildings and Facilities, Animal and Plant Health Inspection Service, Agriculture",1797866.36,49148975.82
"Department of Agriculture","Animal and Plant Health Inspection Service",480,"Miscellaneous Contributed Funds, Animal and Plant Health Inspection Service, Agriculture",10069884.02,8116795.01
"Department of Agriculture","Animal and Plant Health Inspection Service",485,"Foreign Service National Separation Liability Trust Fund, Animal and Plant Health Inspection Service, Agriculture",870206.84,0
"Department of Agriculture","Food Safety and Inspection Service",391,"Food Safety and Inspection Service, Agriculture",1264727409.18,88994429.9
"Department of Agriculture","Food Safety and Inspection Service",474,"Expenses and Refunds, Inspection of Farm Products, Food Safety and Inspection Service, Agriculture",26244081.5,1547663.37
"Department of Agriculture","Grain Inspection, Packers and Stockyards Administration",361,"Salaries and Expenses, Grain Inspection, Packers and Stockyards Administration, Agriculture",44364501.84,4612627.36
"Department of Agriculture","Grain Inspection, Packers and Stockyards Administration",394,"Inspection and Weighing Services, Grain Inspection, Packers and Stockyards Administration, Agriculture",52701318.79,37093094.11
"Department of Agriculture","Agricultural Marketing Service",362,"Marketing Services, Agricultural Marketing Service, Agriculture",220498779.46,60833690.12
"Department of Agriculture","Agricultural Marketing Service",363,"Payments to States and Possessions, Agricultural Marketing Service, Agriculture",66079943.54,9723337.45
"Department of Agriculture","Agricultural Marketing Service",410,"Perishable Agricultural Commodities Act Fund, Agricultural Marketing Service, Agriculture",11319049.86,14589699.47
"Department of Agriculture","Agricultural Marketing Service",420,"Funds for Strengthening Markets, Income, and Supply (Section 32), Agriculture",795626755.84,54880032.1
"Department of Agriculture","Agricultural Marketing Service",468,"Expenses and Refunds, Inspection and Grading of Farm Products, Agricultural Marketing Service, Agriculture",164503638.64,59424987
"Department of Agriculture","Agricultural Marketing Service",289,"Payment to Expenses and Refunds, Inspection and Grading of Farm Products, Agricultural Marketing Service, Agriculture",2250000,0
"Department of Agriculture","Agricultural Marketing Service",473,"Wool Research, Development and Promotion Trust Fund, Agricultural Marketing Service, Agriculture",2094750,153000
"Department of Agriculture","Risk Management Agency",365,"Administrative and Operating Expenses, Office of Risk Management, Agriculture",83060959.03,4336626.65
"Department of Agriculture","Risk Management Agency",395,"Federal Crop Insurance Corporation Fund, Risk Management Agency, Agriculture",8762978440.49,576000000
"Department of Agriculture","Farm Service Agency",375,"Reforestation Pilot Program, Farm Service Agency, Agriculture",600000,0
"Department of Agriculture","Farm Service Agency",297,"Salaries and Expenses, Farm Service Agency, Agriculture",1551526977.91,118957209.06
"Department of Agriculture","Farm Service Agency",287,"State Mediation Grants, Farm Service Agency, Agriculture",3903999.92,704650.53
"Department of Agriculture","Farm Service Agency",321,"Discrimination Claims Settlement, Farm Service Agency, Agriculture",0,27789687.92
"Department of Agriculture","Farm Service Agency",364,"USDA Disaster Assistance, Farm Service Agency, Agriculture",2336907.2,4306468.14
"Department of Agriculture","Farm Service Agency",378,"Emergency Conservation Program, Farm Service Agency, Agriculture",104311752.54,239822534.04
"Department of Agriculture","Farm Service Agency",288,"Emergency Forest Restoration Program, Farm Service Agency, Agriculture",5382341.33,60713096.28
"Department of Agriculture","Farm Service Agency",374,"Grassroots Source Water Protection Program, Farm Service Agency, Agriculture",6500000,0
"Department of Agriculture","Farm Service Agency",319,"Agricultural Credit Insurance Fund Program Account,  Farm Service Agency, Agriculture",621608816.93,26921304.11
"Department of Agriculture","Farm Service Agency",376,"Dairy Indemnity Program, Farm Service Agency, Agriculture",224334.08,0
"Department of Agriculture","Farm Service Agency",396,"Agricultural Credit Insurance Fund, Liquidating Account, Consolidated Farm Service Agency, Agriculture",1072317.33,6263044.74
"Department of Agriculture","Farm Service Agency",380,"Conservation Reserve Program, Farm Service Agency, Agriculture",0,0
"Department of Agriculture","Farm Service Agency",404,"Commodity Credit Corporation Fund, Agriculture",18265965765.08,438824278.21
"Department of Agriculture","Farm Service Agency",390,"Reimbursement for Net Realized Losses, Commodity Credit Corporation",0,0
"Department of Agriculture","Farm Service Agency",325,"Commodity Credit Corporation Export Loans Program Account, Foreign Agricultural Service, Agriculture",22352752.92,6593511.22
"Department of Agriculture","Farm Service Agency",405,"Commodity Credit Corporation Direct Loans, Liquidating Account, Agriculture",607835.96,0
"Department of Agriculture","Farm Service Agency",371,"Farm Storage Facility Loans Program Accounts, Farm Service Agency, Agriculture",11661923,0
"Department of Agriculture","Farm Service Agency",373,"Emergency Boil Weevil Loan Program Account, Farm Service Agency, Agriculture",96078,0
"Department of Agriculture","Farm Service Agency",372,"Apple Loans Program Account, Farmer Service Agency, Agriculture",59993,0
"Department of Agriculture","Farm Service Agency",442,"Agricultural Disaster Relief Trust Fund, Farm Service Agency, Agriculture",577765.62,15184040.46
"Department of Agriculture","Farm Service Agency",446,"Pima Agriculture Cotton Trust Fund, Farm Service Agency, Agriculture",14896000,2.22
"Department of Agriculture","Farm Service Agency",447,"Agriculture Wool Apparel Manufacturers Trust Fund, Farm Service Agency, Agriculture",26572706.72,15846741.86
"Department of Agriculture","Farm Service Agency",475,"Tobacco Trust Fund, Commodity Credit Corporation, Agriculture",0,20126858.63
"Department of Agriculture","Natural Resources Conservation Service",302,"Conservation Operations, Natural Resources Conservation Service, Agriculture",877848124.61,214688619.12
"Department of Agriculture","Natural Resources Conservation Service",305,"Farm Security and Rural Investment Programs, Natural Resources Conservation Service, Agriculture",3683605189.19,3972998471.51
"Department of Agriculture","Natural Resources Conservation Service",382,"Wildlife Habitat Incentives Program, Natural Resources Conservation Service, Agriculture",0,48493.67
"Department of Agriculture","Natural Resources Conservation Service",308,"Watershed and Flood Prevention Operations, Natural Resources Conservation Service, Agriculture",238894871.41,378483481.05
"Department of Agriculture","Natural Resources Conservation Service",303,"Watershed Rehabilitation Program, Natural Resources Conservation Service, Agriculture",34416890.24,27340723.09
"Department of Agriculture","Natural Resources Conservation Service",306,"Resource Conservation and Development, Natural Resources Conservation Services, Agriculture",0,72428.93
"Department of Agriculture","Natural Resources Conservation Service",309,"Wetlands Reserve Program, Natural Resources Conservation Service, Agriculture",0,0
"Department of Agriculture","Natural Resources Conservation Service",310,"Healthy Forests Reserve Program, Natural Resources Conservation Service, Agriculture",0,93
"Department of Agriculture","Natural Resources Conservation Service",354,"Great Plains Conservation Program, Natural Resources Conservation Service",0,0
"Department of Agriculture","Natural Resources Conservation Service",383,"Forestry Incentives Program, Natural Resources Conservation Service",0,0
"Department of Agriculture","Natural Resources Conservation Service",381,"Water Bank Program, Natural Resources Conservation Service, Agriculture",4459598.08,519943.86
"Department of Agriculture","Natural Resources Conservation Service",379,"Colorado River Basin Salinity Control Program, Natural Resources Conservation Service, Agriculture",0,0
"Department of Agriculture","Natural Resources Conservation Service",406,"Damage Assessment and Restoration Revolving Fund, Agriculture",21.84,3256928.92
"Department of Agriculture","Natural Resources Conservation Service",477,"Miscellaneous Contributed Funds, Natural Resources Conservation Service, Agriculture",0,533419.36
"Department of Agriculture","Rural Development",292,"Salaries and Expenses, Rural Development, Agriculture",697187399.34,30732365.45
"Department of Agriculture","Rural Housing Service",343,"Expenses, Rural Housing Assistance Grants, Rural Housing Service",34062873.42,3370424.86
"Department of Agriculture","Rural Housing Service",285,"Rental Assistance Program, Rural Housing Service, Agriculture",1365033000,49370104.69
"Department of Agriculture","Rural Housing Service",347,"Rural Rental Assistance Payments, Rural Housing Service, Agriculture",38662463.07,13010081.76
"Department of Agriculture","Rural Housing Service",348,"Mutual and Self-Help Housing Grants, Rural Housing Service, Agriculture",36614384.51,6262677.64
"Department of Agriculture","Rural Housing Service",342,"Community Facility Loans Program Account, Rural Housing and Community Development Service",292940588.75,9620659.3
"Department of Agriculture","Rural Housing Service",353,"Rural Housing Insurance Fund Program Account, Rural Housing Service, Agriculture",999533550.03,96082213.11
"Department of Agriculture","Rural Housing Service",397,"Rural Housing Insurance Fund, Liquidating Account, Rural Housing Service, Agriculture",28550314.41,77139835.47
"Department of Agriculture","Rural Business_Cooperative Service",352,"Energy Assistance Payments, Rural Business - Cooperative Service, Agriculture",13847642.77,14439685.83
"Department of Agriculture","Rural Business_Cooperative Service",338,"Rural Cooperative Development Grants, Rural Business-Cooperative Service, Agriculture",17562976.38,24846575.2
"Department of Agriculture","Rural Business_Cooperative Service",368,"Rural Economic Development Grants, Rural Business-Cooperative Service, Agriculture",15165105.9,240301036.84
"Department of Agriculture","Rural Business_Cooperative Service",345,"Rural Microenterprise Investment Program Account, Rural Business-Cooperative Service, Agriculture",3608278,319993.71
"Department of Agriculture","Rural Business_Cooperative Service",339,"Rural Business and Industry Loans Program Account, Rural Business and Cooperative Development Service",133781092.5,20956291.16
"Department of Agriculture","Rural Business_Cooperative Service",351,"Intermediary Relending Program Fund Account, Rural Business-Cooperative Service, Agriculture",10273847.94,12593262.51
"Department of Agriculture","Rural Business_Cooperative Service",403,"Rural Development Loan Fund, Liquidating Account, Rural Business-Cooperative Service, Agriculture",0,445487.84
"Department of Agriculture","Rural Business_Cooperative Service",370,"Rural Economic Development Loans Program Account, Rural Business-Cooperative Service, Agriculture",6488511.73,1734858.75
"Department of Agriculture","Rural Business_Cooperative Service",340,"Rural Business Investment Program Account, Rural Business - Cooperative Service, Agriculture",0,2786887
"Department of Agriculture","Rural Business_Cooperative Service",341,"Renewable Energy Program, Rural Business-Cooperative Service, Agriculture",57227982.08,12803445.44
"Department of Agriculture","Rural Business_Cooperative Service",369,"Biorefinery Assistance Program Account, Rural Business - Cooperative Service, Agriculture",59368366,91631634
"Department of Agriculture","Rural Business_Cooperative Service",399,"Alternative Agricultural Research and Commercialization Revolving Fund, Rural Business-Cooperative Service, Agriculture",0,1065703.96
"Department of Agriculture","Rural Utilities Service",349,"High Energy Cost Grants, Rural Utilities Service, Agriculture",17039101,13275854.47
"Department of Agriculture","Rural Utilities Service",346,"Rural Water and Waste Disposal Loans Program Account, Rural Utilities Service",672269750.31,41690973.06
"Department of Agriculture","Rural Utilities Service",322,"Rural Electrification and Telecommunications Loans Program Account, Rural Utilities Service, Agriculture",971640307.9,22143865.56
"Department of Agriculture","Rural Utilities Service",402,"Rural Electrification and Telephone Revolving Fund, Liquidating Account, Rural Utilities Service, Agriculture",1490912741.49,6955131776.61
"Department of Agriculture","Rural Utilities Service",323,"Rural Telephone Bank Program Account, Rural Utilities Service, Agriculture",1217881,2850515.05
"Department of Agriculture","Rural Utilities Service",324,"Distance Learning, Telemedicine and Broadband Program, Rural Utilities Service, Agriculture",155037221.2,41951686.81
"Department of Agriculture","Rural Utilities Service",400,"Rural Development Insurance Fund, Liquidating Account, Rural Utilities Service, Agriculture",0,12835546.44
"Department of Agriculture","Foreign Agricultural Service",366,"Salaries and Expenses, Foreign Agricultural Service, Agriculture",337281197.16,110794754.33
"Department of Agriculture","Foreign Agricultural Service",328,"Scientific Activities Overseas, Foreign Currency Program, Foreign Agricultural Service, Agriculture",0,0
"Department of Agriculture","Foreign Agricultural Service",359,"Ameri Flora '92 Exposition, Foreign Agriculture Service, Agriculture",0,0
"Department of Agriculture","Foreign Agricultural Service",482,"Miscellaneous Contributed Funds, Foreign Agricultural Service, Agriculture",0,1003536.72
"Department of Agriculture","Foreign Agricultural Service",367,"McGovern-Dole International Food for Education and Child Nutrition Program, Foreign Agricultural Service, Agriculture",259971407.62,9082693.87
"Department of Agriculture","Foreign Agricultural Service",355,"Expenses, Public Law 480 Title I, Ocean Freight Differential Grants,  Foreign Agricultural  Service, Agriculture",0,0
"Department of Agriculture","Foreign Agricultural Service",358,"Public Law 480 Title II Grants, Foreign Agricultural Service, Agriculture",3309587901.85,335633201.39
"Department of Agriculture","Foreign Agricultural Service",357,"Public Law 480 Title I Direct Credit and Food for Progress Program Account, Foreign Agricultural Service, Agriculture",14288403,1731328.02
"Department of Agriculture","Foreign Agricultural Service",356,"Public Law 480, Liquidating Account, Foreign Agriculture Service, Agriculture",1271187.09,22105443.76
"Department of Agriculture","Foreign Agricultural Service",484,"Foreign Service National Separation Liability Trust Fund, Foreign Agricultural Service, Agriculture",18011216.89,0
"Department of Agriculture","Food and Nutrition Service",386,"Nutrition Programs Administration, Food and Nutrition Service, Agriculture",152815957.69,24443690.14
"Department of Agriculture","Food and Nutrition Service",384,"Food Stamp Program, Food and Nutrition Service, Agriculture",70915834560.26,36297079356.66
"Department of Agriculture","Food and Nutrition Service",389,"Supplemental Nutrition Assistance Program - Recovery Act, Food and Nutrition Service, Agriculture",0,758677753
"Department of Agriculture","Food and Nutrition Service",388,"Child Nutrition Programs, Food Nutrition Service, Agriculture",22913055062.1,1689121730.39
"Department of Agriculture","Food and Nutrition Service",387,"Special Supplemental Nutrition Program for Women, Infants and Children (WIC), Food and Nutrition Service",6702726232.08,541524041.42
"Department of Agriculture","Food and Nutrition Service",385,"Commodity Assistance Program, Food and Nutrition Service, Agriculture",314297985.88,85514371.12
"Department of Agriculture","Forest Service",311,"Capital Improvement and Maintenance, Forest Service, Agriculture",393470117.12,37054818.61
"Department of Agriculture","Forest Service",312,"Forest and Rangeland Research, Forest Service, Agriculture",346471123.76,20543948.35
"Department of Agriculture","Forest Service",470,"Donations for Forest and Rangeland Research, Forest Service, Agriculture",200,124924.85
"Department of Agriculture","Forest Service",314,"National Forest System, Forest Service, Agriculture",1674014791.47,83484115.05
"Department of Agriculture","Forest Service",431,"Midewin National Tallgrass Prairie Restoration Fund, Forest Service,  Agriculture",0,0.6
"Department of Agriculture","Forest Service",313,"State and Private Forestry, Forest Service, Agriculture",267406133.29,73251706.03
"Department of Agriculture","Forest Service",438,"State and Private Forestry, Forest Service,  Agriculture",62208873.41,7076958.27
"Department of Agriculture","Forest Service",317,"Management of National Forest Lands for Subsistence Uses, Forest Service, Agriculture",2597679.92,125905.91
"Department of Agriculture","Forest Service",315,"Wildland Fire Management, Forest Service, Agriculture",4054087828.38,248418513.53
"Department of Agriculture","Forest Service",318,"Flame Wildfire Suppression Reserve Fund, Forest Service, Agriculture",0,0
"Department of Agriculture","Forest Service",418,"Range Betterment Fund, Forest Service, Agriculture",3434797.2,2002231.07
