"name","sub","size"
"LEADERSHIP DIRECTORIES INC","Office of the Deputy Under Secretary for Congressional Affairs",5750
"LEADING TECH CONSTRUCTION CO","Department of Justice",597529.92
"LECHEL INC","Department of Energy",943567.48
"LEGAL FILES SOFTWARE INC","Commodity Futures Trading Commission",714966.63
"LEGEND CONSTRUCTION AND PAINTING INC","Veterans Employment and Training Services",45786.62
"LEGEND TECHNICAL SERVICES OF ARIZONA INC","International Boundary and Water Commission: U.S.-Mexico",671069.96
"LEIDOS INC","Defense Contract Audit Agency",122100.98
"LEIDOS INC","National Park Service",965977.08
"LEM CONSULTING INCORPORATED","Department of Housing and Urban Development",936367
"LENEER DATA ASSURANCE SOLUTIONS INC","Office of the Assistant Secretary for Administration and Management",810534.93
"LENEER DATA ASSURANCE SOLUTIONS INC","Wage and Hour Division",677600
"LEO A DALY COMPANY","Office of the Chief Readiness Support Officer",298576
"LEONARD RESOURCE GROUP INC THE","Economic Development Administration",229874.45
"LES EQUIPEMENTS ET VENTES DIVERSITECH 1984 LTEE","Office of Job Corps",748471.34
"LESKCA INCORPORATED","Department of Energy",938885.43
"LEWIS PATRICIA","Morris K. Udall and Stewart L. Udall Foundation",24000
"LEXMARK INTERNATIONAL INC","National Transportation Safety Board",884099.35
"LIBRARY ASSOCIATES OF MARYLAND LLC","National Institute of Food and Agriculture",238088.4
"LIBRARY ASSOCIATES OF MARYLAND LLC","Occupational Safety and Health Review Commission",88830
"LIFE FITNESS INC","Transportation Security Administration",927959.57
"LIFE SAFETY GROUP LLC","Special Inspector General for the Troubled Asset Relief Program (TARP)",245580
"LIFELINE FOODS LLC","Foreign Agricultural Service",451728
"LIFELINE NEPAL","Agency for International Development",945832
"LINDE GAS NORTH AMERICA LLC","Domestic Nuclear Detection Office",243515
"LINDE LLC","Defense Microelectronics Activity",933300
"LINDEN RESOURCES INC","National Labor Relations Board",959126.97
"LINDHOLM AND ASSOCIATES INCORPORATED","Inter-American Foundation",371476.33
"LINES GLENN","Millennium Challenge Corporation",602385.69
"LIONHEART ALLIANCE LLC","U.S. Marshals Service",839830.68
"LITTEKEN CONSTRUCTION COMPANY","Federal Aviation Administration",998113.93
"LIVING SHORELINE SOLUTIONS INC","Natural Resources Conservation Service",835266
"LIVINGSTON SLONE INC","U.S. Coast Guard",995667
"LKE CORP","U.S. Army Corps of Engineers - Civil Program Financing Only",988698.5
"LOADPATH LLC","Missile Defense Agency",999986.72
"Lockheed Martin","Office of the Under Secretary for Management",675470.8
"LOGISTICS MANAGEMENT INSTITUTE","Office of the Comptroller of the Currency",775504.8
"LOGISTICS SYSTEMS INCORPORATED","Alcohol and Tobacco Tax and Trade Bureau",438688.8
"LOGISTICS SYSTEMS INCORPORATED","Federal Acquisition Service",999897.1
"LOGISTICS SYSTEMS INCORPORATED","Transportation Security Administration",967567.32
"LONGVIEW-FEDCONSULTING JV LLC","Office of the Chief Readiness Support Officer",511932.12
"LOPEZ AND ASSOCIATES LLP","Federal Transit Administration",596511.86
"LOS ANGELES CITY OF","Department of Veterans Affairs",998319.56
"LOUIS M GERSON CO INC","Office of Assistant Secretary for Preparedness and Response",856852.95
"LOUISIANA STATE UNIVERSITY","National Oceanic and Atmospheric Administration",941124.6
"LOWN ACQUISITION LLC","Department of Veterans Affairs",998652.22
"LRP PUBLICATIONS INC","National Mediation Board",104536
"LRP PUBLICATIONS INC","Office of Human Resource Management",10643
"LRP PUBLICATIONS INC","Office of the Administrator",74650
"LT BUSINESS SOLUTIONS LLC","Mine Safety and Health Administration",805290.2
"LUCCHESI GALATI ARCHITECTS","Forest Service",993435.6
"LUIS EDUARDO CORTEZ SALVATIERRA","Inter-American Foundation",517230.75
"LUNA INNOVATIONS INCORPORATED","U.S. Special Operations Command",999992
"LYME COMPUTER SYSTEMS INC","Food and Drug Administration",971053.68
"LYNDCO INC","Office of the Chief Procurement Officer",979449.33
"LYTLE BEHAVIORAL HEALTH LLC","Substance Abuse and Mental Health Services Administration",337343
"M C DEAN INCORPORATED","Federal Emergency Management Agency",993795.83
"M GROUP PARTNERS LLC","Foreign Agricultural Service",570055.4
"M L BENJAMIN ENTERPRISES INC","U.S. Immigration and Customs Enforcement",877860.15
"MACK DEFENSE LLC","Federal Prison Industries / Unicor",810820.64
"MACROSYS LLC","Federal Transit Administration",988036.8
"MAD SECURITY LLC","Bureau of Labor Statistics",502433.07
"MAGADIA CONSULTING INC","Court Services and Offender Supervision Agency",551383.4
"MAGELLAN SOLUTIONS USA INC","Office of the Comptroller of the Currency",792741.72
"MAGNOLIA OPTICAL TECHNOLOGIES INC","Department of the Army",999998.4
"MAINEWAY SERVICES","Federal Motor Carrier Safety Administration",852031
"MALIK CONSULTING INC","Office of Assistant Secretary for Preparedness and Response",948426.94
"MANAGEAIRE LLC","Office of the Deputy Under Secretary for Congressional Affairs",45758
"MANAGED CARE ADVISORS INC","Office of the Chief Human Capital Officer",685562.26
"MANAGEMENT CONCEPTS INC","Gulf Coast Ecosystem Restoration Council",8306
"MANAGEMENT CONCEPTS INC","Office of Intergovernmental and External Affairs",126485
"MANAGEMENT CONCEPTS INCORPORATED","Office of Government-wide Policy",397217
"MANAGEMENT CONCEPTS INCORPORATED","Office of the Assistant Secretary for Administration",976136
"MANAGEMENT SYSTEMS INTERNATION","Department of State",992316.77
"MANAGEMENT SYSTEMS INTERNATIONAL INC","Bureau of International Labor Affairs",188339.09
"MANCOM INC","Access Board",114700
"MANESH ELECTRONICS INC","Office of Homeland Security and Emergency Coordination",7895
"MANHATTAN MAINTENANCE CO","Transportation Security Administration",979030
"MANHATTAN STRATEGY GROUP LLC THE","Bureau of the Fiscal Service",943518.06
"MANPOWER DEMONSTRATION RESEARC","Office of the Assistant Secretary for Policy",581324
"MANTECH M S M SECURITY SERVICE","U.S. Immigration and Customs Enforcement",954649.15
"MARKO CONSTRUCTION GROUP INC","U.S. Customs and Border Protection",934587.07
"MARTEK GLOBAL SERVICES INC","National Science Foundation",973254.04
"MARTEKD2DINC JV","Office of the Solicitor",470669.63
"MARTIN-BAKER AIRCRAFT CO LTD","Defense Finance and Accounting Service",866851.88
"MARTIN-MISER ASSOCIATES INC","Office of Assistant Secretary of Civil Rights",243899
"MARYN CONSULTING INC","Merit Systems Protection Board",269325
"MARYN CONSULTING INC","National Highway Traffic Safety Administration",775958.32
"MASSACHUSETTS MARITIME ACADEMY PUB INC THE","Maritime Administration",542410
"MATERIALS RESEARCH & DESIGN INC","National Aeronautics and Space Administration",998802
"MATHEMATICA POLICY RESEARCH IN","President's Committee on Employment of the Handicapped",505120.76
"MATHEMATICA POLICY RESEARCH INC","Health Resources and Services Administration",989832
"MATHEMATICA POLICY RESEARCH INC","Office of the Assistant Secretary for Administration and Management",941901.69
"MATHEMATICA POLICY RESEARCH INC","President's Committee on Employment of the Handicapped",480646
"MATHPRO INC","Office of the Chief Economist",90000
"MATSYS INCORPORATED","Defense Threat Reduction Agency",985256.75
"MAVAGI ENTERPRISES INC","U.S. Immigration and Customs Enforcement",987233.91
"MAXARTH LLC","Pretrial Services Agency",254858.4
"MAXLIN INC","Federal Energy Regulatory Commission",767400
"MAYO CLINIC","Agency for Healthcare Research and Quality",480000
"MAZARS LLP","Offices, Boards and Divisions",950000
"MCBRIDE LOCK & ASSOCIATES LLC","Election Assistance Commission",220354.32
"MCBRIDE LOCK & ASSOCIATES LLC","National Science Foundation",763300
"MCCALL FARMS INC","Agricultural Marketing Service",911168.57
"MCCONNELL & JONES","Office of Inspector General",598267.44
"MCDASH ANALYTICS LLC","Bureau of Economic Analysis",116372
"MCGRAW HILL FINANCIAL INC","Federal Energy Regulatory Commission",592642.19
"MCGRAW-HILL COMPANIES INC THE","Federal Energy Regulatory Commission",920912.4
"MCKENZIE CHRISTOPHER ASSOCIATES INC","Selective Service System",42895
"MCKINSEY & COMPANY INC WASHINGTON DC","Federal Highway Administration",917913.48
"MCKINSEY & COMPANY INC WASHINGTON DC","Office of Justice Programs",936396.15
"MCLAUGHLIN COMPANY THE","Employment and Training Administration",644124
"MCNEAL TOMMELITA","Defense Media Activity",569086
"MCP COMPUTER PRODUCTS INC","International Trade Commission",476738.15
"MCP COMPUTER PRODUCTS INC","Small Business Administration",776733.75
"MCQ CONSTRUCTION SERVICES INC","Administrative Office of the U.S. Courts",698129.94
"MCS OF TAMPA INC","Defense Human Resources Activity",996502.32
"MCW SOLUTIONS LLC","Occupational Safety and Health Review Commission",39120.05
"MDF TECHNOLOGIES INC","U.S. Coast Guard",997539.95
"MEDIA ARTS INCORPORATED","Department of Education",994605.78
"MEDIC FIRST AID INTERNATIONAL INCORPORATED","Office of the Chief Human Capital Officer",444000
"MEDICAL ACCESS U LTD","Agency for International Development",984330.07
"MEDICAL DECISION LOGIC INC","National Institutes of Health",999904
"MEHLING SPRAYING SERVICE LLC","Animal and Plant Health Inspection Service",860160
"MEI SERVICES INC","Armed Forces Retirement Home",521622.22
"MELILLO CONSULTING INC","Office of the Special Trustee for American Indians",307222
"MELISSA DATA CORPORATION","U.S. Census Bureau",862995
"MELTECH CORPORATION INC","Office of Chief Financial Officer",20051.24
"MELTECH CORPORATION INC","Office of the Deputy Under Secretary for Congressional Affairs",59756.77
"MENDELSOHNS HOSPITALITY GROUP","Immediate Office of the Secretary of Agriculture",13000
"MERCHANTS AUTOMOTIVE GROUP INCORPORATED","Bureau of Industry and Security",508667.39
"MERCOM INCORPORATED","Department of Justice",288814.07
"MERCOM INCORPORATED","GAO, Except Comptroller General",712236.81
"MERCOM INCORPORATED","Office of Surface Mining, Reclamation and Enforcement",176964.9
"MERIDIAN IMAGING SOLUTIONS INC","National Mediation Board",72135
"MERIDIEN GROUP LLC","Immediate Office of the Secretary",711501.07
"MERIT APPAREL COMPANY INCORPORATED","Office of the Chief Procurement Officer",999844
"MESA MACHINERY SERVICES INCORPORATED","National Institute of Standards and Technology",861790.13
"METAFACTS INC","Bureau of Economic Analysis",209000
"METAMEDIA TRAINING INTERNATIONAL INC","Centers for Disease Control and Prevention",999759
"METRO AUTO AUCTION DALLAS LLC","Federal Acquisition Service",910000
"METRO MAIL SERVICES INC","Small Business Administration",629382
"MFS CONSULTING ENGINEERS LLC","Department of Justice",301385.85
"MGA PARTNERS LLC","Centers for Medicare and Medicaid Services",999459.97
"MICORE SOLUTIONS INC","Agency for International Development",982161.5
"MICROBPLEX INC","Centers for Disease Control and Prevention",987059
"MICROCOM DESIGN INC","National Oceanic and Atmospheric Administration",987303.1
"MICROPACT ENGINEERING INCORPORATED","Office of the Chief Financial Officer",989814.88
"MICROPACT INC","Administrative Review Board",720265.2
"MICROPACT INC","Occupational Safety and Health Review Commission",114601.66
"MICROPACT INC","Office of Administrative Services",161848.39
"MICROPACT INC","Office of Mission Assurance",531229.42
"MICROPACT INC","Office of the Administrator",78185.45
"MICROPACT INC","Peace Corps",454047.3
"MICROPACT INC","U.S. Patent and Trademark Office",761053.15
"MICROSEMI CORP-RF POWER PRODUCTS","Federal Aviation Administration",988072
"MICROSOFT CORPORATION SITZ IN REDMOND CORPORATION","Federal Election Commission",528411
"MICROSOFT CORPORATION SITZ IN REDMOND CORPORATION","Federal Mediation and Conciliation Service",137820
"MICROSOFT CORPORATION SITZ IN REDMOND CORPORATION","Office of the Under Secretary for Management",973000
"MICROSOFT CORPORATION SITZ IN REDMOND CORPORATION","Selective Service System",425000
"MID-ATLANTIC INTERPRETING GROUP INC","Washington Headquarters Services",946270.1
"MID-ATLANTIC PARKING SERVICES INC","National Appeals Division",27000
"MID-ATLANTIC PARKING SERVICES INC","Office of the Chief Readiness Support Officer",564042
"MIDD WEST INDUSTRIES INC","U.S. Army Corps of Engineers - Civil Program Financing Only",985120.57
"MIDDLEMAN LOUIS I","The Council of the Inspectors General on Integrity and Efficiency",31500
"MIDTOWN PERSONNEL INC","Corporation for National and Community Service",569930.37
"MIDTOWN PERSONNEL INC","Department of Education",926432.96
"MIDTOWN PERSONNEL INC","National Endowment for the Humanities",547630
"MIDTOWN PERSONNEL INC","Office of Administrative Services",558038.4
"MIKALA LAURIDSEN","Departmental Offices",978444.11
"MILES TREASTER & ASSOCIATES","Risk Management Agency",258596.47
"MILLENNIUM SERVICES 2000 INCORPORATED","National Science Foundation",810409.51
"MILLIMAN INC","Employee Benefits Security Administration",346350
"MINBURN TECHNOLOGY GROUP LLC","International Trade Commission",286184.15
"MINBURN TECHNOLOGY GROUP LLC","Office of Government Ethics",82277.13
"MINBURN TECHNOLOGY GROUP LLC","Technology Transformation Service",223380
"MINDBANK CONSULTING GROUP LLC","Office of Inspector General",549442.4
"MINDPETAL SOFTWARE SOLUTIONS INC","Peace Corps",896290.55
"MINDPOINT GROUP LLC","National Technical Information Service",927366.7
"MINELIGHT ADVISORS INC","Economic Research Service",190162
"MISCELLANEOUS FOREIGN AWARDEES","Department of Labor",9195.61
"MISCELLANEOUS FOREIGN AWARDEES","Department of Transportation",35210.96
"MISCELLANEOUS FOREIGN AWARDEES","Library of Congress",96046.41
"MISCELLANEOUS FOREIGN AWARDEES","Peace Corps",581089.38
"MISCELLANEOUS FOREIGN AWARDEES","Substance Abuse and Mental Health Services Administration",25807.13
"MITRETEK SYSTEMS INC","National Security Agency/Central Security Service",285549
"MITSUBISHI ELECTRIC POWER PRODUCTS INC","Federal Aviation Administration",974225.98
"MJL ENTERPRISES LLC","Railroad Retirement Board",321035.71
"MOBILE VIDEO SERVICES LTD","Office of Information and Public Affairs",119977.93
"MOBOMO LLC","Office of the Administrator",732365.04
"MOI INC","Bureau of International Labor Affairs",884158.36
"MOI INC","Office of Administrative Law Judges",23509.21
"MOI INC","Office of the Assistant Secretary for Policy",36184.99
"MONO MACHINES LLC","Committee for Purchase from People Who Are Blind or Severely Disabled",15662.6
"MOOG INC","Federal Bureau of Investigation",920000
"MORGANFRANKLIN CORPORATION","Office of Chief Financial Officer",548782.57
"MORNINGSTAR INC","Employee Benefits Security Administration",235500
"MORPHO DETECTION LLC","Office of the Chief Security Officer",70000
"MORRISON MATTHEW","Overseas Private Investment Corporation",645000
"MOSQUITOMATE INC","Centers for Disease Control and Prevention",999994.02
"MOTIR SERVICES INCORPORATED","Office of Administrative Services",145891.2
"MOTOR COACH INDUSTRIES INC","Department of Justice",567634
"MOTOROLA INCORPORATED","Federal Law Enforcement Training Center",921207.7
"MOUNTAIN BLADE RUNNER LLC","Bureau of Land Management",985240.03
"MRF CONSULTING LLC","Federal Trade Commission",749217.25
"MS CLEAN SERVICES INC","U.S. Coast Guard",999695.73
"MS JULIE LLC","National Oceanic and Atmospheric Administration",975450.63
"MSOL INC","Office of the Chief Financial Officer",968924.5
"MSS SERVICES INC","U.S. Coast Guard",981298.37
"MUNDUS BISHOP DESIGN INC","National Park Service",982745.91
"MY BUSINESS MATCHES INC","Minority Business Development Agency",500000
"MYTHICS INC","Defense Security Cooperation Agency",593822.46
"MYTHICS INC","Domestic Nuclear Detection Office",652354.73
"MYTHICS INC","Office of Operations",428152.01
"MYTHICS INC","Pipeline and Hazardous Materials Safety Administration",568649.25
"MYTHICS INC","USTRANSCOM",365670.09
"NALAS ENGINEERING SERVICES INC","Defense Threat Reduction Agency",995819
"NASHVILLE WIRE PRODUCTS MFG CO","Federal Prison Industries / Unicor",962545.26
"NATIONAL ACADEMY OF SCIENCES","Bureau of Ocean Energy Management",661419
"NATIONAL ACADEMY OF SCIENCES","Health Resources and Services Administration",895000
"NATIONAL ACADEMY OF SCIENCES","Immediate Office of the Secretary of Transportation",932504.44
"NATIONAL ACADEMY OF SCIENCES","Office of Health Affairs",313580
"NATIONAL CAPITOL CONTRACTING LLC","Defense Media Activity",944725
"NATIONAL CAPITOL CONTRACTING LLC","Securities and Exchange Commission",889168.91
"NATIONAL COMMUNITY INVESTMENT FUND","Community Development Financial Institutions Fund",771812.5
"NATIONAL ENERGY ASSISTANCE DIRECTORS ASSOCIATION INC","Office of the Assistant Secretary for Administration",964306.66
"NATIONAL FOUNDATION CENTER FOR DISEASE CONTROL AND PREVENTION INC","Federal Emergency Management Agency",991048.24
"NATIONAL INDUSTRIES FOR THE BLIND","U.S. Postal Service",175935
"NATIONAL JOURNAL GROUP INC","Office of Congressional Relations",5890
"NATIONAL MINORITY SUPPLIER DEVELOPMENT COUNCIL INC NMSCD","Minority Business Development Agency",598588.8
"NATIONAL PATIENT SAFETY FOUNDATION","Defense Health Agency",903505.53
"NATURIPE FOODS LLC","Agricultural Marketing Service",815250.78
"NAVAJO TRIBAL UTILITY AUTHORITY","Indian Health Service",962230.77
"NAVARRO R & ASSOCIATES CPAS","Employment and Training Administration",920617.87
"NAVISTAR INC","Federal Prison Industries / Unicor",948081.98
"NAVISTAR INC","International Boundary and Water Commission: U.S.-Mexico",925737
"NAVSYS CORPORATION THE","Defense Advanced Research Projects Agency",999992
"NCALL RESEARCH INC","Rural Housing Service",822855
"NCI INFORMATION SYSTEMS INC","Technology Transformation Service",213688.32
"NCR GOVERNMENT SYSTEMS LIMITED LIABILITY COMPANY","Office of the Chief Procurement Officer",981961.65
"NCSEML JOINT VENTURE LLC","Internal Revenue Service",959272
"NEBRASKA BEAN INC","Agricultural Marketing Service",951823.97
"NELSON ROBERT","Grain Inspection, Packers and Stockyards Administration",73274.16
"NET ESOLUTIONS CORPORATION","Health Resources and Services Administration",899933.63
"NETAMERICA CORPORATION THE","Department of Housing and Urban Development",979270
"NETAMERICA CORPORATION THE","U.S. Patent and Trademark Office",812346.71
"NETCENTRIC TECHNOLOGIES INC","Office of Executive Secretariat",10000
"NETCOM TECHNOLOGIES INC","Department of the Air Force",995593.62
"NETIMPACT STRATEGIES INC","Bureau of Industry and Security",930436.3
"NETPLEX GROUP INCORPORATED THE","Millennium Challenge Corporation",747452.08
"NETWORK MANAGEMENT RESOURCES","Health Resources and Services Administration",805400.19
"NETWORKING INSTITUTE OF TECHNOLOGY INCORPORATED","Committee for Purchase from People Who Are Blind or Severely Disabled",137440
"NEW AGE PROTECTION INC","Administrative Office of the U.S. Courts",614696.09
"NEW BEDFORD PANORAMEX CORP","Department of Transportation",59947
"NEW CENTURY ADVISORS LLC","Pension Benefit Guaranty Corporation",770000
"NEW CENTURY IMAGING INC","U.S. Patent and Trademark Office",724087.49
"NEW MEXICO STATE UNIVERSITY","Department of Defense",992028
"NEW ORLEANS SMALL BUSINESS ENGINEERING JV","U.S. Army Corps of Engineers - Civil Program Financing Only",992065.6
"NEW TECH SOLUTIONS INC","Bureau of the Fiscal Service",919967.5
"NEW TECH SOLUTIONS INCORPORATED","Financial Crime Enforcement Network",380750
"NEW TECH SOLUTIONS INCORPORATED","Natural Resources Conservation Service",778949.28
"NEW TECH SOLUTIONS INCORPORATED","Office of Homeland Security and Emergency Coordination",41675.74
"NEW TECH SOLUTIONS INCORPORATED","Office of Procurement and Property Management",9528.02
"NEWBURG EGG CORP","Food and Nutrition Service",871984.77
"NEXT DIMENSION TECHNOLOGIES INC","Office of Procurement Operations",750000
"NEXTECH MATERIALS LTD","Department of the Air Force",996114
"NEXTECH SOLUTIONS LLC","Defense Information Systems Agency",975943.65
"NEXTSTEP TECHNOLOGY INC","Office of Inspector General",697135.78
"NGANET INC","Office of Human Resource Management",35710.96
"NGEN LLC","U.S. Patent and Trademark Office",940323.66
"NIELSEN COMPANY US LLC THE","Economic Research Service",604662
"NIELSEN COMPANY US LLC THE","Food and Drug Administration",950790
"NIEVES LLITERAS Y ASOCIADOS SC","Export-Import Bank of the United States",743046.9
"NIOWAVE INC","Department of Energy",994653
"NOKOMIS INC","Defense Microelectronics Activity",999985.94
"NORMAN HUMBERTO SAGASTUME MARTINEZ","Inter-American Foundation",336661.04
"NORTEL GOVERNMENT SOLUTIONS INCORPORATED","Office of Intelligence and Analysis",460876.87
"NORTH CENTRAL COMMODITIES INC","Foreign Agricultural Service",489922.2
"NORTHERN BAG AND BOX COMPANY","Farm Service Agency",856922.39
"Northrop Grumman","Defense Human Resources Activity",966465.12
"Northrop Grumman","Defense Microelectronics Activity",405623
"Northrop Grumman","Office of Personnel Management",964675.97
"NORTHSHORE DIGESTIVE MEDICINE","Department of Veterans Affairs",997650
"NORTHSTAR TECHNOLOGY CORP","Occupational Safety and Health Administration",548466.12
"NORTHWEST HELICOPTERS I INC","Bureau of Land Management",954470.2
"NOVA TECHNOLOGY CO LTD","Department of Agriculture",56477.34
"NOVACES LLC","Economic Development Administration",304389.28
"NOVAKULTURA CONSULTING","National Endowment for the Arts",71625
"NOVALINK SOLUTIONS LLC","Bureau of Labor Statistics",965160
"NOVATEUR RESEARCH SOLUTIONS LLC","Immediate Office of the Secretary of Transportation",899920.99
"NPD GROUP INC THE","Bureau of Economic Analysis",427080
"NSI-MI TECHNOLOGIES LLC","National Institute of Standards and Technology",986950
"NU TREK INC","Missile Defense Agency",999992
"NUCLEAR CAUSAL FACTORS LLC","Defense Nuclear Facilities Safety Board",152469.67
"NUMAT TECHNOLOGIES INC","Department of the Army",999999.99
"NURSES FIRST STAFFING LLC","Indian Health Service",962065
"NUWAVE SOLUTIONS LLC","Export-Import Bank of the United States",644352
"NVE INC","Nuclear Regulatory Commission",886895
"OAK RIDGE ASSOCIATED UNIVERSITIES INCORPORATED","Morris K. Udall and Stewart L. Udall Foundation",299400.4
"OBRIEN & ASSOCIATES INTERNATIONAL INC","Bureau of International Labor Affairs",459936
"OCEAN GROVE RV SALES INC","Federal Emergency Management Agency",961848
"OCEANWIDE REPAIR OAKLAND INC","Maritime Administration",639295
"OCEM ACQUSITION CORP","Federal Aviation Administration",974820.83
"OFFICE DEPOT INC","Gulf Coast Ecosystem Restoration Council",4339.2
"OFFICE DEPOT INC","Substance Abuse and Mental Health Services Administration",4856.82
"OFFICE DESIGN GROUP","Merit Systems Protection Board",140508.84
"OFFICE IMAGES INC","Bureau of Alcohol, Tobacco, Firearms and Explosives Acquisition and Property Management Division",899225.35
"OFFICE LEADER CORP","Office of Labor-Management Standards",49345
"OGE ENERGY CORP","Federal Prison System / Bureau of Prisons",976002.44
"OLBN ARCHITECTURAL SERVICE INC","Office of Operations",656911.27
"OLGOONIK TECHNICAL SERVICES LLC","Agency for International Development",963806.4
"OLIN CORPORATION","U.S. Marshals Service",991371.01
"OMEGA MICRO TECHNOLOGIES INC","Department of the Navy",999957
"OMNI HOTELS MANAGEMENT CORPORATION","Office of the Chief Human Capital Officer",77507.24
"OMNIFICS INC","Assistant Secretary for Departmental Management",82142.64
"OMNIFICS INC","Executive Office of the President",519612.47
"OMNISOLVE INC","Office of Government-wide Policy",358678.58
"ONEXIA INC","Bureau of Engraving and Printing",609515.1
"ONIX NETWORKING CORP","National Mediation Board",43082.51
"ONLINE VIDEO SERVICE INC","Administrative Conference of the U.S.",5800
"ONLINE VIDEO SERVICE INC","Election Assistance Commission",248849.81
"OPPIX AND HIDER INCORPORATED","Employment Standards Administration",38138
"OPPORTUNITY FINANCE NETWORK","Community Development Financial Institutions Fund",999029.71
"OPTECH LIMITED LIABILITY COMPANY","Occupational Safety and Health Administration",934273.51
"OPTIMATION TECHNOLOGY INC","Saint Lawrence Seaway Development Corporation",64749
"OPTOWARES INCORPORATED","Missile Defense Agency",999989
"OPTOWARES INCORPORATED","U.S. Special Operations Command",999537.56
"OPTRA INC","Office of Procurement Operations",451391.82
"ORGANIZATIONAL SCIENCES LLC","Office of Health Affairs",115000
"ORIZON INC","Executive Office of the President",547638.15
"OROKU TRANSPORTATION CO","Defense Commissary Agency",796567.25
"ORRICK HERRINGTON & SUTCLIFFE LLP","Overseas Private Investment Corporation",700000
"ORTIZ GROUP ENGINEERING AND CONSTRUCTION SERVICES CORP","Administrative Office of the U.S. Courts",582674.21
"OTIS ELEVATOR COMPANY","Nuclear Regulatory Commission",972467.06
"OTTER TAIL POWER COMPANY","Bureau of Indian Affairs and Bureau of Indian Education",868218.34
"OUDENS & KNOOP ARCHITECTS PC","National Institute of Standards and Technology",864323
"P B I INC","Office of Communication",67297.97
"PAC COMM INC","U.S. Coast Guard",969921.87
"PACIFIC GAS AND ELECTRIC COMPANY","United States Mint",891811.18
"PACKING SERVICES INTERNATIONAL S A","Office of Intergovernmental and External Affairs",22032.82
"PALMETTO HOSPITALITY OF WASHINGTON DC II LLC","The Council of the Inspectors General on Integrity and Efficiency",33750
"PANAMERICA COMPUTERS INC","Bureau of the Fiscal Service",954638.15
"PANAMERICA COMPUTERS INC","Community Development Financial Institutions Fund",382998.08
"PANAMERICA COMPUTERS INC","Financial Crime Enforcement Network",528373.89
"PANAMERICA COMPUTERS INC","Office of the Chief Security Officer",258683.2
"PANAMERICA COMPUTERS INC","Office of the Under Secretary for Science and Technology",981087.33
"PANUM TELECOM LLC","Agricultural Marketing Service",983779.04
"PANUM TELECOM LLC","Natural Resources Conservation Service",981352.37
"PARAGON SYSTEMS INC","Offices, Boards and Divisions",984244.9
"PARAMETRIC STUDIO INC","Department of Education",900000
"PARAMOUNT CONSTRUCTION GROUP LLC","National Park Service",983356
"PARK AMERICA INC","Office of the Chief Readiness Support Officer",930867
"PARKER TIDE CORP","Office of Chief Financial Officer",157607.92
"PARKER TIDE CORP","Rural Housing Service",717997.57
