"name","sub","size"
"GTSI CORP","U.S. Secret Service",970180.16
"GTT GLOBAL TELECOM GOVERNMENT SERVICES LLC","National Geospatial-Intelligence Agency",119258.33
"GUERZON AND ASSOCIATES LLC","Court Services and Offender Supervision Agency",849960
"GUIDRY LIASON GROUP INC","Foreign Agricultural Service",807691.8
"GUILLERMO TELLO","Departmental Offices",992529.65
"GULF OF MEXICO ALLIANCE","Gulf Coast Ecosystem Restoration Council",115000
"GUREVICH MICHAEL","National Endowment for the Arts",244800
"GUROO LLC","Railroad Retirement Board",977759.97
"H&S RESOURCES CORPORATION","Bureau of International Labor Affairs",419781.65
"HACH COMPANY","U.S. Geological Survey",898086.03
"HAGERSTOWN GOODWILL INDUSTRIES INC","Public Buildings Service",979645.9
"HALFAKER AND ASSOCIATES LLC","Office of the Inspector General",822372.6
"HALTER FAITH","Office of Budget and Program Analysis",6000
"HALVIK CORP","Federal Transit Administration",709673
"HAMILTON ENTERPRISES LLC","Gulf Coast Ecosystem Restoration Council",203403.61
"HAMILTON ENTERPRISES LLC","National Institute of Standards and Technology",946911.98
"HAMILTON PRODUCTS GROUP INC","U.S. Postal Service",5256.16
"HANES SUPPLY INC","Saint Lawrence Seaway Development Corporation",70494.84
"HANKS HANKS & ASSOCIATES LLC","Federal Motor Carrier Safety Administration",322384.2
"HARMAN FUNERAL SERVICES","Uniformed Services University of the Health Sciences",530913.58
"HARMONIC INTERNATIONAL INC","Maritime Administration",544628.9
"HARP ENGINEERING LLC","Department of the Army",999999.9
"HARPER RAINS STOKES & KNIGHT P","National Telecommunications and Information Administration",357543.58
"HARPER RAINS STOKES & KNIGHT P","Office of Workers Compensation Program",552325
"HARRIS CORPORATION","Broadcasting Board of Governors",934006.94
"HARRIS CORPORATION","National Aeronautics and Space Administration",998654.96
"HARRIS CORPORATION","National Highway Traffic Safety Administration",877051.86
"HART ENERGY PUBLISHING LLLP","Office of Advocacy and Outreach",27500
"HARTWIG INC","United States Mint",958896.59
"HAVER ANALYTICS INC","Executive Office of the President",626460
"HAWLEY-THOMAS ENTERPRISES INC","National Institute of Food and Agriculture",199756.8
"HAWORTH INC","Agency for International Development",999865.14
"HAWORTH INC","Employees Compensation Appeals Board",7402.27
"HAWORTH INC","Office of Labor-Management Standards",14889
"HAY GROUP INC","Defense Human Resources Activity",987892
"HB & COMPANY INC","Federal Trade Commission",907865.06
"HEALTH DEPARTMENT OKLAHOMA STATE","Social Security Administration",979898.32
"HEALTH PROTECTION AGENCY","Office of Assistant Secretary for Preparedness and Response",518507.81
"HEARTLAND ENERGY PARTNERS LLC","Office of Homeland Security and Emergency Coordination",640864.95
"HELIOS REMOTE SENSING SYSTEMS INC","Missile Defense Agency",999995.37
"HELIOS RESOURCES LTD","Bureau of Indian Affairs and Bureau of Indian Education",989528
"HENDALL INC","Substance Abuse and Mental Health Services Administration",25000
"HENDRY SHIPYARD VENTURE NO 3 LLC","U.S. Coast Guard",984248.82
"HERITAGE REPORTING CORP","Occupational Safety and Health Review Commission",50000
"HERMAN MILLER INC","Employment Standards Administration",59525.84
"HERRICK TECHNOLOGY LABORATORIES INC","U.S. Special Operations Command",962165
"HEWLETT-PACKARD COMPANY INC","Office of Government-wide Policy",932510
"HICKMANS EGG RANCH INC","Agricultural Marketing Service",882675
"HIGH PLAINS COMPUTING INC","Office of the Chief Financial Officer",981350.02
"HIGH STREET CONSULTING GROUP","Federal Transit Administration",774952.59
"HILLAH AYAYI E","Risk Management Agency",197295
"HILLS STERN MORLEY","Overseas Private Investment Corporation",710000
"HILTON HOTELS CORPORATION","Equal Employment Opportunity Commission",893666.75
"HIRE ONE PERSONNEL SERVICES OF WASHINGTON DC LLC","Administrative Conference of the U.S.",107320
"HIRE ONE PERSONNEL SERVICES OF WASHINGTON DC LLC","Federal Mine Safety and Health Review Commission",638408.81
"HLN CONSULTING LLC","Centers for Disease Control and Prevention",986243.28
"HOF CONSTRUCTION INC","Rural Housing Service",555198
"HOLLAND SIGNAL INC","Defense Logistics Agency",995741.21
"HOLM DEL RAY & SONS INC","Agricultural Marketing Service",788051.4
"HOLON CONSULTING","Morris K. Udall and Stewart L. Udall Foundation",78747.46
"HOMESTEAD FARMS","Bureau of Land Management",986505.7
"HON COMPANY LLC THE","Office of the Deputy Under Secretary for Congressional Affairs",10079.46
"Honeywell","National Archives and Records Administration",967638.62
"Honeywell","U.S. Secret Service",962213.17
"HOPE GAS INC","Federal Bureau of Investigation",919764.58
"HOTARD COACHES INC","Armed Forces Retirement Home",329489.5
"HOUGHTON MIFFLIN HARCOURT PUBLISHING COMPANY","Department of Defense Education Activity",879160.83
"HOUSER WALKER ARCHITECTURE LLC","Administrative Office of the U.S. Courts",837789.17
"HP ENTERPRISE SERVICES LLC","Immediate Office of the Secretary of Transportation",906473.34
"HP ENTERPRISE SERVICES LLC","Office of Health Affairs",445121.4
"HP ENTERPRISE SERVICES LLC","Office of Procurement Operations",403602
"HP ENTERPRISE SERVICES LLC","Office of the Chief Security Officer",357565.94
"HPS MECHANICAL INC","International Boundary and Water Commission: U.S.-Mexico",710001.11
"HR ANEW INC","National Indian Gaming Commission",8182.8
"HR ANEW INC","U.S. Immigration and Customs Enforcement",882256.8
"HRWORX LLC","Office of Ethics",395211.5
"HRWORX LLC","Office of Human Resource Management",21046.73
"HUANG-GAGHAN JOINT VENTURE","Smithsonian Institution",812283.55
"HUANG-GAGHAN JV TWO","Bureau of Engraving and Printing",564870
"Humana","Centers for Medicare and Medicaid Services",829868.14
"Humana","Defense Contract Management Agency",971617.36
"Humana","Equal Employment Opportunity Commission",2212000
"Humana","Grain Inspection, Packers and Stockyards Administration",113129.19
"Humana","Office of Assistant Secretary of Civil Rights",274661.72
"HURRICANE CONSULTING INC","Immediate Office of the Secretary",876072.98
"HY-LITE CONSTRUCTION LLC","Department of Transportation",93512.45
"HYDABURG COOPERATIVE ASSOCIATION","Forest Service",971661
"HYDRO INC","Centers for Disease Control and Prevention",987677.77
"HYDROS CONSULTING INC","Bureau of Reclamation",994269.91
"HYMAN BRICKLE & SON INC","Committee for Purchase from People Who Are Blind or Severely Disabled",17920
"HYPERION BIOTECHNOLOGY INC","Uniformed Services University of the Health Sciences",564408.08
"IBM","Advisory Council on Historic Preservation",106126.6
"IBM","Commodity Futures Trading Commission",743101.72
"IBM","Immediate Office of the Secretary of Transportation",929354.45
"IBM","National Agricultural Statistics Service",1074500.7
"IBM","Railroad Retirement Board",908553.12
"ICF INCORPORATED","Employment and Training Administration",647616
"ICF INCORPORATED","Environmental Protection Agency",972256.47
"ICF INCORPORATED","Federal Trade Commission",950852
"ICF INCORPORATED LLC","Department of Education",943041
"ICF INCORPORATED LLC","Federal Trade Commission",804105
"ICF INCORPORATED LLC","Office of the Chief Economist",169346
"ICF INCORPORATED LLC","Veterans Employment and Training Services",378125
"IDEALS INC","U.S. Special Operations Command",991040.21
"IDEATION INC","Office of Special Counsel",313972.64
"IDRISS I M","Federal Energy Regulatory Commission",517126
"IHS GLOBAL INC","Assistant Secretary for Departmental Management",355000
"IHS GLOBAL INC","Bureau of Indian Affairs and Bureau of Indian Education",874505.26
"IHS GLOBAL INC","Bureau of Ocean Energy Management",598145
"IHS GLOBAL INC","Bureau of Safety and Environmental Enforcement",607085.87
"IHS GLOBAL INC","Defense Contract Management Agency",819570.14
"IHS GLOBAL INC","International Trade Commission",551205
"IHS GLOBAL INC","Maritime Administration",655541.48
"IHS GLOBAL INC","National Science Foundation",800881
"IINA BA INC","Bureau of Indian Affairs and Bureau of Indian Education",925772.28
"IMAGETREND INC","Office of Health Affairs",788086.16
"IMBUE TECHNOLOGY SOLUTIONS INC","Department of Energy",999483.94
"IMMERSIVE CONCEPTS LLC","Office of the Inspector General",835801.81
"IMMIGRATION & CUSTOMS ENFORCEMENT BUREAU OF","Merit Systems Protection Board",84583.31
"IMMIXGROUP INC","Small Business Administration",648589.97
"IMMIXTECHNOLOGY INC","Advisory Council on Historic Preservation",24872.24
"IMMIXTECHNOLOGY INC","Bureau of Alcohol, Tobacco, Firearms and Explosives Acquisition and Property Management Division",860352.09
"IMMIXTECHNOLOGY INC","Defense Security Service",854675.76
"IMMIXTECHNOLOGY INC","Federal Communications Commission",859307.73
"IMMIXTECHNOLOGY INC","General Services Administration",542321.58
"IMMIXTECHNOLOGY INC","Immediate Office of the Secretary",648905.29
"IMMIXTECHNOLOGY INC","Minority Business Development Agency",14357.38
"IMMIXTECHNOLOGY INC","Office of Federal Contract Compliance Program",120229.09
"IMMIXTECHNOLOGY INC","Office of Human Resource Management",23861
"IMMIXTECHNOLOGY INC","Office of Personnel Management",843101.71
"IMMIXTECHNOLOGY INC","Privacy and Civil Liberties Oversight Board",24904.88
"IMMIXTECHNOLOGY INC","Selective Service System",31588.25
"IMMUNALYSIS CORP","Pretrial Services Agency",272260
"IMPACT INNOVATIONS SYSTEMS INC","U.S. Citizenship and Immigration Services",820324.84
"IMPAQ INTERNATIONAL LLC","President's Committee on Employment of the Handicapped",470721.48
"IMPRES TECHNOLOGY SOLUTIONS INC","National Technical Information Service",131973.54
"IMPRES TECHNOLOGY SOLUTIONS INC","Occupational Safety and Health Administration",678911.71
"IMS GOVERNMENT SOLUTIONS INC","Bureau of Economic Analysis",82160.23
"IN SPACE LLC","Department of the Air Force",996026.87
"INDUSTRIAL ECONOMICS INC","National Protection and Programs Directorate",775209.14
"INDUSTRIAL ECONOMICS INCORPORATED","Consumer Product Safety Commission",744833.46
"INDUSTRIAL WIRE ROPE SUPPLY COMPANY INC","Saint Lawrence Seaway Development Corporation",35441
"INFINISOURCE CONSULTING SOLUTIONS INC","Financial Crime Enforcement Network",492586.4
"INFINITY CONFERENCE GROUP INC","Office of the Chief Economist",40610
"INFLAMMATIX INC","Defense Advanced Research Projects Agency",999923
"INFORELIANCE CORPORATION","Defense Finance and Accounting Service",805838.49
"INFORELIANCE CORPORATION","Office of the Inspector General for Tax Administration",193361.21
"INFORMA BUSINESS INTELLIGENCE INC","Office of the Chief Economist",29435
"INFORMATION RESOURCES INC","Economic Research Service",898000
"INFORMATION TECHNOLOGY COALITION INC","Washington Headquarters Services",936161.7
"INNOVATIO ASSESSORIA LTDA","Inter-American Foundation",371829.45
"INNOVATION RESEARCH AND TRAINING INC","National Institutes of Health",999969
"INNOVATIONS FOR POVERTY ACTION","Millennium Challenge Corporation",660823.79
"INNOVATIVE DESIGN AND RESEARCH INC","Department of the Navy",999956
"INNOVATIVE NONPROFIT SOLUTIONS GROUP LLC THE","Substance Abuse and Mental Health Services Administration",939487
"INQUEST SOLUTIONS INC","Office of Assistant Secretary of Civil Rights",239696.4
"INSIGHT PUBLIC SECTOR INC","Bureau of Industry and Security",255330.54
"INSIGHT PUBLIC SECTOR INC","Department of Commerce",197507.45
"INSIGHT PUBLIC SECTOR INC","Export-Import Bank of the United States",774308.67
"INSIGHT PUBLIC SECTOR INC","Millennium Challenge Corporation",810203.33
"INSIGHT PUBLIC SECTOR INC","National Technical Information Service",368510.24
"INSIGHT PUBLIC SECTOR INC","National Telecommunications and Information Administration",606975.06
"INSIGHT PUBLIC SECTOR INC","National Transportation Safety Board",608410.34
"INSIGHT PUBLIC SECTOR INC","Office of Communication",230224
"INSPECTION EXPERTS INC","Drug Enforcement Administration",942889.22
"INSTITUTE FOR DEFENSE ANALYSES INCORPORATED","National Protection and Programs Directorate",800000
"INSTITUTE OF ELECTRICAL AND ELECTRONICS ENGINEERS INCORPORATED THE","Domestic Nuclear Detection Office",480280
"INSTITUTE OF ELECTRICAL AND ELECTRONICS ENGINEERS INCORPORATED THE","Office of the Chief Information Officer",751662
"INTACT TECHNOLOGY INC","Pension Benefit Guaranty Corporation",841730.06
"INTEGRAL CONSULTING SERVICES INCORPORATED","U.S. Special Operations Command",931578
"INTEGRATED FEDERAL SOLUTIONS INC","Federal Maritime Commission",43643.04
"INTEGRATED RESOURCE INVENTORIES INC","Forest Service",972487.2
"INTEGRATED SOLUTIONS FOR SYSTEMS INC","Office of Procurement Operations",749673.92
"INTEGRATED SYSTEMS","Bureau of Engraving and Printing",987720.11
"INTEGRATION TECHNOLOGIES GROUP","Defense Commissary Agency",944189.6
"INTEGRATION TECHNOLOGIES GROUP INC","Privacy and Civil Liberties Oversight Board",2902.96
"INTEGUMENT TECHNOLOGIES INC","Department of Defense",989112.53
"INTELLIGENT DECISIONS INC","Department of Commerce",231037.23
"INTELLIGENT DECISIONS INC","Economic Development Administration",129393.02
"INTELLIGENT DECISIONS INC","Federal Bureau of Investigation",949504.8
"INTELLIGENT DECISIONS INC","Office of the Secretary",749401.98
"INTELLIGENT FISCAL OPTIMAL SOLUTIONS LLC","National Institute of Food and Agriculture",220244.4
"INTELLIGENT FISCAL OPTIMAL SOLUTIONS LLC","Office of the Chief Financial Officer",787929.64
"INTELLIORB TECHNOLOGIES LLC","Office of the Chief Procurement Officer",998120
"INTELLIPEAK SOLUTIONS INC","Alcohol and Tobacco Tax and Trade Bureau",437875.25
"INTELLIPEAK SOLUTIONS INC","Bureau of the Fiscal Service",929317.46
"INTELLIPEAK SOLUTIONS INC","Office of the Inspector General",858448.66
"INTER-FLUVE INC","Bureau of Reclamation",937324.54
"INTERACTIVE DATA CORPORATION","Office of the Chief Economist",149719.84
"INTERACTIVE MEDICAL SPECIALISTS INCORPORATED","Federal Prison System / Bureau of Prisons",948738.51
"INTERFACE AMERICAS INC","Bureau of Economic Analysis",358523.66
"INTERFACE CONSTRUCTION CORPORATION","U.S. Postal Service",11150
"INTERIOR ARCHITECTURE & DESIGN PLLC","Environmental Protection Agency",963735.62
"INTERIOR RESOURCE GROUP INC","Office of Administrative Law Judges",47946.37
"INTERNATIONAL CENTER FOR LANGUAGE STUDIES INC","Agency for International Development",973270
"INTERNATIONAL CIVIL RIGHTS INV","Office of Assistant Secretary of Civil Rights",418181.09
"INTERNATIONAL ELECTRONIC MACHINES CORPORATION","Department of the Navy",999874
"INTERNATIONAL LEADERSHIP CONSULTING LLC","Armed Forces Retirement Home",739855.49
"INTERNATIONAL PAPER COMPANY","Defense Commissary Agency",797596.61
"INTERNATIONAL PROCUREMENT AGENCY USA INC","Office of Intergovernmental and External Affairs",22822.65
"INTERNATIONAL SCIENTIFIC TECHNOLOGIES INC","Defense Threat Reduction Agency",993382.44
"INTERNATIONAL WATER INSTITUTE","Natural Resources Conservation Service",829136
"INTERPARK LLC","U.S. Immigration and Customs Enforcement",898920
"INTRAMICRON INC","Department of the Navy",999968
"INTUIT INC","Federal Labor Relations Authority",95407.68
"IOWA STATE UNIVERSITY OF SCIENCE AND TECHNOLOGY","Animal and Plant Health Inspection Service",912748.38
"IOWA STATE UNIVERSITY OF SCIENCE AND TECHNOLOGY","Federal Bureau of Investigation",889980
"IQ SOLUTIONS INC","Food and Drug Administration",958250
"IRON BOW TECHNOLOGIES LLC","Bureau of Industry and Security",422789.01
"IRON BOW TECHNOLOGIES LLC","International Trade Administration",342134.67
"IRON BOW TECHNOLOGIES LLC","Office of Justice Programs",892672.87
"IRON MOUNTAIN INFORMATION MANAGEMENT LLC","Departmental Offices",980812.68
"IRON MOUNTAIN INFORMATION MANAGEMENT LLC","Employee Benefits Security Administration",685166.61
"IRON SWORD ENTERPRISES LLC","United States Mint",947400
"ISLAND CONTRACTING INC","Office of Operations",777671.93
"ISOFT SOLUTIONS LLC","Pretrial Services Agency",672956.05
"ISW LLC","National Geospatial-Intelligence Agency",957875
"IT PARTS GLOBALCOM INC","Office of Homeland Security and Emergency Coordination",26005
"IT TECH DIRECT LLC","U.S. Secret Service",823397.35
"ITELLECT LLC","Defense Information Systems Agency",931577.96
"J & A GARRIGUES SLP","Export-Import Bank of the United States",975000
"J & L AMERICA INC","U.S. Postal Service",5231.77
"J KENT & ASSOCIATES INC","Federal Mine Safety and Health Review Commission",162287.68
"J KENT & ASSOCIATES INC","Occupational Safety and Health Review Commission",87253.92
"J&M GLOBAL SOLUTIONS LLC","Economic Development Administration",560925.93
"JACK BROWN PRODUCE INC","Food and Nutrition Service",898890.16
"JACKSON ENERGY COOPERATIVE CORPORATION","Federal Prison System / Bureau of Prisons",993336.02
"JACOB STERN & SONS INC","Farm Service Agency",861300
"JACOBS ENGINEERING GROUP INC","Federal Housing Finance Agency",625000
"JACOBS PROJECT MANAGEMENT CO","Social Security Administration",980300
"JACOBS TECHNOLOGY INC","Immediate Office of the Secretary of Transportation",991304.14
"JCL ELECTRONICS INC","Federal Prison Industries / Unicor",896442.29
"JE HURLEY INC","Social Security Administration",947112
"JE RICHARDS INCORPORATED","National Gallery of Art",961086
"JEFFERSON CONSULTING GROUP LLC","Minority Business Development Agency",74069.14
"JEL MANAGEMENT","Office of the Chief Procurement Officer",984300
"JENKINS GROUP INC THE","Defense Commissary Agency",997894.73
"JENN-KANS INC","National Institute of Standards and Technology",946572.62
"JENNINGS PHIL D","Bureau of Land Management",993550
"JENTEK SENSORS INC","Immediate Office of the Secretary of Transportation",999685
"JFW INDUSTRIES INCORPORATED","National Telecommunications and Information Administration",450882.8
"JHC TECHNOLOGY INC","International Trade Administration",858118.25
"JIMENEZ ENGINEERING SOLUTIONS LLC","Surface Transportation Board",4500
"JJA CONSULTANTS INC","Economic Development Administration",250000
"JLG INDUSTRIES INCORPORATED","Office of the Chief Security Officer",59764.5
"JOHNS HOPKINS UNIVERSITY THE","Health Resources and Services Administration",905800.6
"JOHNSON ENVIRONMENTAL","Forest Service",962491.64
"JOINT COMMISSION RESOURCES INC","Armed Forces Retirement Home",370933.45
"JORTEX INC","Federal Prison Industries / Unicor",877349.3
"JOSEPH UKO","Armed Forces Retirement Home",361920
"JPI","U.S. Customs and Border Protection",936767.95
"JR TRI-STATE GENERAL CONTRACTING GROUP INC","Administrative Office of the U.S. Courts",954525.34
"JUNIPER SYSTEMS INC","Natural Resources Conservation Service",953010
"JUNOVENTURE LLC","Defense Contract Audit Agency",244384
"JUNOVENTURE LLC","Department of State",985976.81
"K & A INDUSTRIES INC","Office of Mission Assurance",36868.65
"K & R INDUSTRIES INC","Office of Human Resource Management",23120
"K TEYA MOORE & ASSOCIATES PA","Special Inspector General for the Troubled Asset Relief Program (TARP)",137020
"KAISER ASSOCIATES INC","Office of Administrative Services",928414.4
"KAISER FOUNDATION HEALTH PLAN OF THE NORTHWEST","Agency for Healthcare Research and Quality",770644.47
"KALIJARVI CHUZI & NEWMAN PC","Federal Maritime Commission",55000
"KANOO GROUP LLC","USTRANSCOM",522464.02
"KANSAS STATE UNIVERSITY","Office of Health Affairs",657646
"KARCO ENGINEERING LLC","National Highway Traffic Safety Administration",785303.72
"KARN CHARUHAS CHAPMAN & TWOHEY PC","Defense Intelligence Agency",596259.36
"KARSUN SOLUTIONS LLC","Office of the Chief Human Capital Officer",362526.4
"KAUFFMAN & ASSOCIATES INC","Bureau of Indian Affairs and Bureau of Indian Education",864256.73
"KCORP TECHNOLOGY SERVICES INC","U.S. Immigration and Customs Enforcement",895257.06
"KEARNEY & COMPANY PC","Defense Contract Management Agency",827400.6
"KEARNS & WEST INC","Morris K. Udall and Stewart L. Udall Foundation",118547.88
"KELLOGG BROWN & ROOT SERVICES INC","Defense Intelligence Agency",204425.74
"KELLY ANDERSON & ASSOCIATES INC","Corporation for National and Community Service",508181.6
"KELLY ANDERSON & ASSOCIATES INC","Office of Administrative Services",438000
"KELLY PAUL KENNARD","Corporation for National and Community Service",475000
"KENWOOD USA CORPORATION","American Battle Monuments Commission",825.48
"KENWOOD USA CORPORATION","Office of Assistant Secretary for Planning and Evaluation",4145.75
"KETCHIKAN READY-MIX & QUARRY INC","Department of Agriculture",161870
"KETCHUM INC","Office of Communication",400000
"KEY & ASSOCIATES PC","Department of Housing and Urban Development",920972.08
"KEY & ASSOCIATES PC","National Capital Planning Commission",23720.72
"KEY CONCEPTS KNOWLEDGEBASE LLC","Economic Research Service",800051.84
"KEYLOGIC SYSTEMS INC","Internal Revenue Service",948937.7
"KEYSTONE OCEAN SERVICES INC","Maritime Administration",691180.77
"KGB MEDIA LLC","National Highway Traffic Safety Administration",728382
"KIMBALL INTERNATIONAL INC","Offices, Boards and Divisions",997628.53
"KIMLEY-HORN AND ASSOCIATES INC","United States Trade and Development Agency",638000
"KM MANAGEMENT GROUP LLC","Federal Aviation Administration",990935.26
"KNIGHT POINT SYSTEMS LLC","Occupational Safety and Health Administration",817746.81
"KNIGHT PROTECTIVE SERVICE INC",NA,490082.35
"KNOLL INC","Risk Management Agency",98305.48
"KNOWLEDGE CONSULTING GROUP INC","National Capital Planning Commission",49569.64
"KO-AM ENTERPRISES INC","Department of Commerce",203783.29
"KOMATSURANGEL INC","Defense Commissary Agency",956342.66
"KONIAG SERVICES INC","Consumer Product Safety Commission",921636.64
"KONICA MINOLTA BUSINESS SOLUTIONS USA INC","Federal Labor Relations Authority",35995
"KONICA MINOLTA BUSINESS SOLUTIONS USA INCORPORATED","Farm Service Agency",889014.54
"KONICA MINOLTA BUSINESS SOLUTIONS USA INCORPORATED","Natural Resources Conservation Service",871142.54
"KONICA MINOLTA BUSINESS SOLUTIONS USA INCORPORATED","Office of Administrative Law Judges",30916.63
"KPAUL PROPERTIES LLC","Election Assistance Commission",136048.5
"KPAUL PROPERTIES LLC","Office of Mission Assurance",4879
"KPMG EAST AFRICA LTD","Department of State",967590
"KPMG LLP","Corporation for National and Community Service",556346.63
"KROLL ONTRACK LLC","Office of the Inspector General for Tax Administration",225650
"KRUG INC","U.S. Citizenship and Immigration Services",977876.52
"KUTSCH DENISE LOWE","Overseas Private Investment Corporation",990000
"KYMA TECHNOLOGIES INC","Missile Defense Agency",999994.91
"KYOCERA DOCUMENT SOLUTIONS AMERICA INC","Office of Labor-Management Standards",15309.54
"KYOCERA MITA AMERICA INC","Administrative Review Board",3545.64
"KYOCERA MITA AMERICA INC","Animal and Plant Health Inspection Service",952810.02
"KYOCERA MITA AMERICA INC","Benefits Review Board",8156.02
"L & M POLICY RESEARCH LLC","Agency for Healthcare Research and Quality",208925.83
"L C INDUSTRIES INC","Immediate Office of the Under Secretary for Science and Technology",11878.75
"L D C CONSTRUCTION CO INC","U.S. Army Corps of Engineers - Civil Program Financing Only",994316.5
"L-3 APPLIED TECHNOLOGIES INC","Federal Bureau of Investigation",935744.86
"L-3 NATIONAL SECURITY SOLUTIONS INC","Office of Procurement and Property Management",519957.1
"L3 Communications","Bureau of Indian Affairs and Bureau of Indian Education",927480.6
"L3 Communications","Consumer Financial Protection Bureau",863330.72
"L3 Communications","Defense Information Systems Agency",939255.13
"L3 Communications","Defense Intelligence Agency",674118.75
"L3 Communications","Defense Nuclear Facilities Safety Board",317228.24
"L3 Communications","Department of Defense Education Activity",963946.78
"L3 Communications","Department of Housing and Urban Development",1871537.69
"L3 Communications","Employment Standards Administration",16763.34
"L3 Communications","Farm Service Agency",866573.54
"L3 Communications","Federal Mediation and Conciliation Service",695783.98
"L3 Communications","National Endowment for the Humanities",686198
"L3 Communications","National Geospatial-Intelligence Agency",464470.33
"L3 Communications","National Institute of Food and Agriculture",387019.28
"L3 Communications","Office of Administrative Services",765290.16
"L3 Communications","Office of Assistant Secretary for Planning and Evaluation",15426.99
"L3 Communications","Office of Communications and Marketing",306989.92
"L3 Communications","Office of Homeland Security and Emergency Coordination",49300
"L3 Communications","Office of Information and Public Affairs",57250
"L3 Communications","Office of Job Corps",920658.18
"L3 Communications","Office of the Chief Information Officer",764231.05
"L3 Communications","Office of the Special Trustee for American Indians",234825.56
"L3 Communications","Peace Corps",579840.91
"L3 Communications","Securities and Exchange Commission",904854.07
"L3 Communications","Selective Service System",291704.42
"L3 Communications","The Council of the Inspectors General on Integrity and Efficiency",27177.84
"L3 Communications","U.S. Special Operations Command",948592.67
"L3 Communications","United States Chemical Safety Board",483835.49
"L3 ELECTRON DEVICES INC","Defense Finance and Accounting Service",743514
"LABOR DELAWARE DEPARTMENT OF","Equal Employment Opportunity Commission",752850
"LABVANTAGE SOLUTIONS INCORPORATED 3484","Consumer Product Safety Commission",707033.68
"LADLAS PRINCE LLC","Wage and Hour Division",108418.44
"LANGDON INC","Environmental Protection Agency",962158
"LANGUAGE LINE LLC","Federal Emergency Management Agency",993379.59
"LANTECH INC","Department of Defense Education Activity",943280
"LARSON & MCGOWIN LLC","Department of Agriculture",39486
"LAVI INDUSTRIES","Transportation Security Administration",959755.08
"LAW MANAGER INC","Merit Systems Protection Board",143724
"LAW MANAGER INC","Office of the Solicitor",159771.4
"LAWDENSKY CONSTRUCTION INC","Public Buildings Service",983785.23
"LAZ PARKING LTD LLC","U.S. Marshals Service",831707.36
"LC PAVING & SEALING INC","Bureau of Land Management",981985.97
"LCH CONSULTING LLC","Bureau of Ocean Energy Management",558205.08
"LE COMPTE PC","Office of the Special Trustee for American Indians",378381.42
"LEADER FUEL CENTER LLC THE","The Council of the Inspectors General on Integrity and Efficiency",70000
